Link,Location,Title,Date,Time,Description,Price,Location
http://generalassemb.ly/education/facebook-advertising-101-making-facebook-advertising-pay/boston/37454,Boston,Facebook Advertising 101: Making Facebook Advertising Pay,"Wednesday, 6 September",6:30,"Facebook Advertising is the hottest area of paid advertising available on the internet today.  With targeting abilities that rival any other advertising platform, there exists no better way to get the word out about your business then with Facebook Advertising. This cutting edge course will teach you the secrets the pros use to make Facebook Advertising pay.",75,Atlanta
http://generalassemb.ly/education/adobe-indesign-bootcamp/washington-dc/39485,"Washington, D.C.",Adobe InDesign Bootcamp,"Saturday, 26 August",10,"Bring your creative ideas to life with Adobe InDesign, the professional page layout standard, used by designers and production professionals to design, preflight, and publish a broad range of documents such as brochures, catalogs, magazines and books. InDesign allows you to lay out and design multiple page documents. This workshop is designed to get you up and running with Adobe InDesign in one day. The focus will be on step-by-step instruction leading students through the most important tools and concepts in InDesign.",185,Atlanta
http://generalassemb.ly/education/creating-video-content-on-a-budget/london/38808,London,Creating Video Content on a Budget,"Wednesday, 26 July",6:15,Are you new to video making or do you want to learn some new creative production tips? This introductory video class looks at essential video equipment as well as more advanced concepts. You will receive expert advice on techniques that can be applied to existing or future video projects.,35,Atlanta
http://generalassemb.ly/education/intro-to-digital-marketing/seattle/39540,Seattle,Intro To Digital Marketing,"Monday, 14 August",6,See the strategies that drive today’s biggest brands.,0,Atlanta
http://generalassemb.ly/education/code-in-one-day-html-css-crash-course/atlanta/38373,Atlanta,Code in One Day: HTML & CSS Crash Course,"Friday, 4 August",10,"HTML and CSS are the fundamental building blocks of the web. Whether you're a beginner who wants to get started in web development, a designer looking to hand-code their concepts, or a marketer who wants a little more control over their CMS, you'll need to know HTML and CSS to get the job done.",150,Atlanta
http://generalassemb.ly/education/business-metrics-fundamentals/new-york-city/38202,New York City,Business Metrics Fundamentals,"Tuesday, 12 September",6:30,"Whether you’re a CEO, CFO, COO, product manager, investor, or marketer, having a strong grasp of analytics and metrics is an essential tool to have at your disposal. In this class, you’ll learn how to use the right analytics to grow your business, motivate your team, and communicate a coherent story to stakeholders using hard numbers. You’ll learn about revenue modeling, analytics tool evaluations, marketing unit economics, metrics-driven activity prioritization, and stakeholder communication using metrics.",75,Atlanta
http://generalassemb.ly/education/user-experience-design-bootcamp/washington-dc/37444,"Washington, D.C.",User Experience Design Bootcamp,"Saturday, 22 July",10,"As technology changes and more media outlets compete for customers’ time, providing an enjoyable experience is critical to both attracting and keeping users.  This class aims to demystify UX by giving a practical and simple introduction to what UX is while also explaining some of its core concepts of usability.  This is a field that affects all areas of business — prepare to dip your toes into an ocean of new concepts and ideas that will enlighten your perspective on the  human-computer interaction experience.",200,Atlanta
http://generalassemb.ly/education/sql-bootcamp-learning-the-language/san-francisco/39254,San Francisco,SQL Bootcamp: Learning the Language,"Sunday, 6 August",10,"SQL is a powerful language, and tool, for data analysis and data handling. In this bootcamp, you’ll dive deep into SQL syntax and database structures, while applying your new SQL skills to address business problems. This bootcamp will take absolute beginners through the basics of SQL to an ability to write queries with confidence.",299,Atlanta
http://generalassemb.ly/education/intro-to-agile-and-lean-bootcamp/london/37705,London,Intro to Agile and Lean Bootcamp,"Friday, 4 August",10,"Scrum, Kanban, Agile and Lean. We've all heard these terms but what do they mean and how can some of these approaches help the work that we do. This bootcamp will cover the basics of Agile, Lean, Scrum and Kanban. This bootcamp will arm you with the knowledge to help you understand and talk about the basic principles for each of these.",190,Atlanta
http://generalassemb.ly/education/introduction-to-google-analytics/san-francisco/37893,San Francisco,Introduction to Google Analytics,"Thursday, 5 October",6:30,"Google Analytics is an incredibly robust, free tool for measuring web traffic data. In this class, you’ll get to know the basics of using Google Analytics to track and evaluate performance and draw insights to improve your business. Starting with basic terminology and key metrics, you’ll build a foundation of knowledge before diving deeper into more complex analytics techniques, including advertising tracking and custom segments. You’ll walk away with a fundamental understanding of Google Analytics’ role in running and operating your business.",65,Atlanta
http://generalassemb.ly/education/product-marketing-fundamentals/san-francisco/38894,San Francisco,Product Marketing Fundamentals,"Friday, 29 September",10,This class is an introduction to product marketing for web technology products. We will cover:,65,Atlanta
http://generalassemb.ly/education/sql-bootcamp-learning-the-language/san-francisco/39257,San Francisco,SQL Bootcamp: Learning the Language,"Sunday, 13 August",10,"SQL is a powerful language, and tool, for data analysis and data handling. In this bootcamp, you’ll dive deep into SQL syntax and database structures, while applying your new SQL skills to address business problems. This bootcamp will take absolute beginners through the basics of SQL to an ability to write queries with confidence.",299,Atlanta
http://generalassemb.ly/education/excel-bootcamp/new-york-city/38471,New York City,Excel Bootcamp,"Saturday, 30 September",10,"The bootcamp is designed to provide students with a general overview of Excel topics and specifically more knowledge of several different functions. It combines most of the material from the two workshops into an intense one-day session. Given the short timeframe and large amount of topics covered, students are expected to be able to learn quickly. The bootcamp is designed for students who can pick up material quickly and are looking to go from relatively little knowledge of Excel to being able to achieve complex tasks in just one day.",299,Atlanta
http://generalassemb.ly/education/code-in-one-day-html-css-crash-course/los-angeles/38222,Los Angeles,Code in One Day: HTML & CSS Crash Course,"Saturday, 26 August",10,"HTML and CSS are the fundamental building blocks of the web. Whether you're a beginner who wants to get started in web development, a designer looking to hand-code their concepts, or a marketer who wants a little more control over their CMS, you'll need to know HTML and CSS to get the job done.",250,Atlanta
http://generalassemb.ly/education/introduction-to-google-analytics/atlanta/39186,Atlanta,Introduction to Google Analytics,"Saturday, 26 August",12,"Google Analytics is an incredibly robust, free tool for measuring web traffic data. In this class, you’ll get to know the basics of using Google Analytics to track and evaluate performance and draw insights to improve your business. Starting with basic terminology and key metrics, you’ll build a foundation of knowledge before diving deeper into more complex analytics techniques, including advertising tracking and custom segments. You’ll walk away with a fundamental understanding of Google Analytics’ role in running and operating your business.",50,Atlanta
http://generalassemb.ly/education/product-management-bootcamp/new-york-city/38349,New York City,Product Management Bootcamp,"Saturday, 26 August",10,"You’re full of ideas, but how do you know which are worth working on?  In the first half of the workshop, you’ll learn how to use the MVP (Minimum Viable Product) philosophy to test and validate your ideas with the least amount of work required.  The ultimate goal is to get to product/market fit.  Take your idea and get moving in the right direction quickly and efficiently.",299,Atlanta
http://generalassemb.ly/education/python-for-data-science-2bf903ff-147f-4f7b-85e6-cb6b0b623a08/boston/36416,Boston,Python for Data Science,"Saturday, 19 August",10,"Python is a versatile and widely-used programming language with many applications.  This workshop explores Python's place in the scientific ecosystem, and how the language, with several readily-available open-source libraries, can serve as a powerful tool for data analysis.  Designed as a stand-alone introduction to the data science aspects of Python, this class is also a recommended preparatory workshop for students planning to enroll in General Assembly's Data Science course.",180,Atlanta
http://generalassemb.ly/education/data-analytics-101-01095432-8af6-4a75-b00f-694d0589f258/new-york-city/38498,New York City,Data Analytics 101,"Wednesday, 26 July",6:30,Learn how data drives better business.,60,Atlanta
http://generalassemb.ly/education/understanding-google-analytics-bootcamp/london/37308,London,Understanding Google Analytics Bootcamp,null,null,"Google Analytics is the most commonly used web analytics tool in the world today. Though by only using the default settings, most users aren’t utilising the platform to its fullest extent.",250,Atlanta
http://generalassemb.ly/education/social-media-strategy-mapping/seattle/39492,Seattle,Social Media Strategy Mapping,"Tuesday, 25 July",5:30,"Social media initiatives don’t start when you register a Facebook or Twitter account and start posting announcements, it begins much sooner. In this workshop, you’ll be taken through a 6-step methodology that will help guide your efforts to develop an actionable social media strategy. You’ll learn how to structure your social media efforts, deploy your resources, and ultimately launch a social media campaign that is professional and provides results you’ll be able to interpret and understand.",50,Atlanta
http://generalassemb.ly/education/coding-for-beginners-html-and-css/london/38658,London,Coding for Beginners: HTML and CSS,"Thursday, 27 July",6:15,"HTML and CSS are the fundamental building blocks of the web. Whether you're a beginner who wants to get started in web development, a designer looking to hand-code their concepts, or a marketer who wants a little more control over their CMS, you'll need to know HTML and CSS to get the job done.",55,Atlanta
http://generalassemb.ly/education/creating-a-customer-experience-strategy-that-works/melbourne/38235,Melbourne,Creating a Customer Experience Strategy that Works,"Thursday, 20 July",6,"Customer experience is fast becoming the key battleground for businesses in all industries. With customers becoming more knowledgeable and savvy, delivering a customer experience that “Wows” customers is a key differentiator in the market.",70,Atlanta
http://generalassemb.ly/education/product-management-bootcamp/denver/37372,Denver,Product Management Bootcamp,"Saturday, 9 September",10,"You’re full of ideas, but how do you know which are worth working on?  In the first half of the workshop, you’ll learn how to use the MVP (Minimum Viable Product) philosophy to test and validate your ideas with the least amount of work required.  The ultimate goal is to get to product/market fit.  Take your idea and get moving in the right direction quickly and efficiently.",175,Atlanta
http://generalassemb.ly/education/visual-design-fundamentals/san-francisco/39125,San Francisco,Visual Design Fundamentals,"Monday, 21 August",7,"The goal of visual design is to communicate a specific message to a targeted audience. Through the intentional and aesthetic manipulation of elements, one is able to influence and inspire. Color theory, layout and typography are among the many areas covered in this course, as well as common practices, such as creative briefs and approval processes.",40,Atlanta
http://generalassemb.ly/education/sql-bootcamp/atlanta/38426,Atlanta,SQL Bootcamp,"Saturday, 26 August",10,SQL provides powerful but reasonably simple tools for data analysis and handling.  This bootcamp will take absolute beginners through the basics of SQL to an ability to write queries with confidence.  We will use a combination of lecture and in-class exercises to ensure that students leave with a working grasp of SQL fundamentals.,150,Atlanta
http://generalassemb.ly/education/introduction-to-python-bootcamp/san-francisco/39253,San Francisco,Introduction to Python Bootcamp,"Saturday, 5 August",10,"Python is a versatile and widely-used programming language with many applications. This workshop explores Python's place in the scientific ecosystem, and how the language, with several readily-available open-source libraries, can serve as a powerful tool for data analysis. Designed as a stand-alone introduction to the data science aspects of Python, this class is also a recommended refresher for students planning to enroll in General Assembly's upcoming Data Science course. The course is hands-on and exercise based, so students will get plenty of practice.",250,Atlanta
http://generalassemb.ly/education/designing-your-solution-no-design-skills-needed/los-angeles/38948,Los Angeles,Designing Your Solution (no design skills needed!),"Sunday, 6 August",11,Do you have dreams of bringing your own digital product to market?,120,Atlanta
http://generalassemb.ly/education/intro-to-ux-design-247ed3ff-cbb9-48f7-93c2-9a7353e5ae75/seattle/39331,Seattle,Intro to UX Design,"Thursday, 6 July",6,Discover how design shapes our online experiences.,0,Atlanta
http://generalassemb.ly/education/picture-this-instagram-for-business/london/37701,London,Picture This: Instagram for Business,"Monday, 17 July",6:15,"As one of the fastest-growing social networks of our decade, Instagram has risen to the top of the content food chain, and is constantly adding new features and tricks for you or your business to take advantage of.",25,Atlanta
http://generalassemb.ly/education/introduction-to-google-analytics/new-york-city/38440,New York City,Introduction to Google Analytics,"Wednesday, 16 August",6:30,"Google Analytics is an incredibly robust, free tool for measuring web traffic data. In this class, you’ll get to know the basics of using Google Analytics to track and evaluate performance and draw insights to improve your business. Starting with basic terminology and key metrics, you’ll build a foundation of knowledge before diving deeper into more complex analytics techniques, including advertising tracking and custom segments. You’ll walk away with a fundamental understanding of Google Analytics’ role in running and operating your business.",90,Atlanta
http://generalassemb.ly/education/introduction-to-digital-marketing/austin/38796,Austin,Introduction to Digital Marketing,"Wednesday, 16 August",6:30,See the strategies that drive today’s biggest brands.,35,Atlanta
http://generalassemb.ly/education/intro-to-ux-design-a-free-class/boston/38884,Boston,Intro to UX Design: A Free Class,"Wednesday, 12 July",6:30,"As technology changes and more media outlets compete for customers’ time, providing an enjoyable experience is critical to both attracting and keeping users. This class aims to demystify user experience by giving a practical and simple introduction to UX through exploring some of its core concepts.",0,Atlanta
http://generalassemb.ly/education/coding-101-html-css/atlanta/38442,Atlanta,Coding 101: HTML & CSS,"Saturday, 19 August",10,"Meet the programming languages that power the web, and write your first line of code.",28,Atlanta
http://generalassemb.ly/education/adobe-indesign-bootcamp/new-york-city/38504,New York City,Adobe InDesign Bootcamp,"Saturday, 29 July",10,"Bring your creative ideas to life with Adobe InDesign, the professional page layout standard, used by designers and production professionals to design, preflight, and publish a broad range of documents such as brochures, catalogs, magazines and books. InDesign allows you to lay out and design multiple page documents. This workshop is designed to get you up and running with Adobe InDesign in one day. The focus will be on step-by-step instruction leading students through the most important tools and concepts in InDesign.",299,Atlanta
http://generalassemb.ly/education/visual-design-101/new-york-city/38436,New York City,Visual Design 101,"Tuesday, 11 July",6:30,Get creative with Adobe Photoshop.,75,Atlanta
http://generalassemb.ly/education/data-analytics-101-01095432-8af6-4a75-b00f-694d0589f258/atlanta/39222,Atlanta,Data Analytics 101,"Saturday, 23 September",10,Learn how data drives better business.,30,Atlanta
http://generalassemb.ly/education/seo-bootcamp/los-angeles/39284,Los Angeles,SEO Bootcamp,"Saturday, 29 July",10,"Search engine optimization (SEO) is often thought of as a complex and long-term process for marketers. But there are many quick and easy steps you can take to improve your website traffic and start a successful SEO campaign. Students will walk away with a solid base to create a search engine optimized web presence, plus a customized comprehensive plan to continue their efforts.",85,Atlanta
http://generalassemb.ly/education/excel-at-excel-getting-down-the-basics/san-francisco/38650,San Francisco,Excel at Excel: Getting Down the Basics,"Friday, 22 September",10,"We’ve all heard of Microsoft Excel, and yet a surprising number of people have little to no experience using it. In this class — ideal for people working in business, management, or simply interested in getting more organized — you’ll learn the basics of the application, including calculation, formatting, and charts. There will also be an introduction to some intermediate functions such as VLookup and If-Then. A basic understanding of Excel goes a very long way when it comes to managing your job or business. This class will make you more desirable job candidate and more productive as a worker.",40,Atlanta
http://generalassemb.ly/education/digital-marketing-key-concepts-and-metrics/new-york-city/38207,New York City,Digital Marketing: Key Concepts and Metrics,"Thursday, 24 August",6:30,"The digital landscape is moving at a lightning fast pace. Every industry has been affected by the advances in digital, from retailers to brands and agencies.",60,Atlanta
http://generalassemb.ly/education/introduction-to-google-adwords/boston/37447,Boston,Introduction to Google AdWords,"Thursday, 17 August",6:30,"Google AdWords is designed to help you reach potential customers at the exact right moment. This workshop will walk you through what you need to know to get started with this highly powerful, highly technical, advertising platform. Students will learn keyword audience targeting, how to design effective ad copy, and how to estimate you ad’s success.",75,Atlanta
http://generalassemb.ly/education/get-the-picture-introduction-to-infographics/sydney/38555,Sydney,Get the Picture: Introduction to Infographics,"Thursday, 27 July",6,"Displaying information in a clear and compelling way is a valuable asset for any marketing manager, PR professional, entrepreneur, or anyone needing to give context to numbers.",50,Atlanta
http://generalassemb.ly/education/digital-marketing-bootcamp--2/london/37917,London,Digital Marketing Bootcamp,"Friday, 8 September",10,"The digital landscape is moving at lightning speed. Every industry has been affected by the advances in digital—from retail to brands and agencies. Has your manager recently assigned a digital marketing role to you? Are you a project or account manager at a creative agency? Do you work for a small company or a start-up, and handle all things digital on your own? Then this bootcamp may be just what you need! Specifically created for students and professionals interested in gaining a deeper understanding of everything digital marketing can encompass.",190,Atlanta
http://generalassemb.ly/education/product-management-bootcamp/boston/36401,Boston,Product Management Bootcamp,"Saturday, 22 July",10,"You’re full of ideas, but how do you know which are worth working on?",250,Atlanta
http://generalassemb.ly/education/sql-bootcamp/boston/36414,Boston,SQL Bootcamp,"Saturday, 9 September",10,SQL provides powerful but reasonably simple tools for data analysis and handling.  This bootcamp will take absolute beginners through the basics of SQL to an ability to write queries with confidence.  We will use a combination of lecture and in-class exercises to ensure that students leave with a working grasp of SQL fundamentals.,250,Atlanta
http://generalassemb.ly/education/introduction-to-python-bootcamp/denver/37371,Denver,Introduction to Python Bootcamp,"Saturday, 9 September",10,"Python is a versatile and widely-used programming language with many applications. This workshop explores Python's place in the scientific ecosystem, and how the language, with several readily-available open-source libraries, can serve as a powerful tool for data analysis. Designed as a stand-alone introduction to the data science aspects of Python, this class is also a recommended refresher for students planning to enroll in General Assembly's upcoming Data Science course. The course is hands-on and exercise based, so students will get plenty of practice.",175,Atlanta
http://generalassemb.ly/education/digital-marketing-bootcamp--2/los-angeles/38785,Los Angeles,Digital Marketing Bootcamp,"Saturday, 9 September",10,"This interactive, activity driven class will enable you to reach and engage your audience in your organizational space. You will then identify how to track and drive them toward relevant conversion points and KPIs.",250,Atlanta
http://generalassemb.ly/education/data-analytics-101-01095432-8af6-4a75-b00f-694d0589f258/new-york-city/38500,New York City,Data Analytics 101,"Thursday, 28 September",6:30,Learn how data drives better business.,60,Atlanta
http://generalassemb.ly/education/the-career-experiment-making-your-job-work-for-you/atlanta/38973,Atlanta,The Career Experiment - Making Your Job Work For You,"Thursday, 21 September",6:30,"We've all been told that if we follow our passions, they'll lead us to a fulfilling and happy career. Unfortunately that's only one piece of the equation, so many people spend years of their life chasing after something that can never be obtained, while feeling like a failure along the way. Even worse, some people remain in jobs they hate far longer than they should because they don't know how to make their next move.",30,Atlanta
http://generalassemb.ly/education/storytelling-with-video-content/melbourne/39478,Melbourne,Storytelling with Video Content,"Wednesday, 30 August",6,Taking audiences from rational to emotional engagement through storytelling is all but common knowledge in the marketing world today. Yet how to do that often remains elusive and seems like magic.,70,Atlanta
http://generalassemb.ly/education/user-experience-design-bootcamp/los-angeles/38403,Los Angeles,User Experience Design Bootcamp,"Saturday, 5 August",10,"As technology changes and more media outlets compete for customers’ time, providing an enjoyable experience is critical to attracting and retaining customers and for businesses and organizations to be successful. This class aims to demystify UX by giving a practical and simple introduction to what UX is while also explaining some of its core concepts of usability. This is a field that affects all areas of business, government, education and non-profit organizations, and is one of the fastest growing professions in the tech industry.",250,Atlanta
http://generalassemb.ly/education/programming-for-non-programmers-the-basics--2/new-york-city/38421,New York City,Programming for Non-Programmers - The Basics,"Wednesday, 2 August",6,Are you a creative or entrepreneur that wishes you could speak tech with your web development team? Maybe you wish you could code a bit yourself? Programming for Non-Programmers is workshop series at General Assembly designed to help non-programmers communicate more efficiently with developers or to help aspiring developers get started.,140,Atlanta
http://generalassemb.ly/education/introduction-to-adobe-illustrator-weekend-workshop/los-angeles/38788,Los Angeles,Introduction to Adobe Illustrator: Weekend Workshop,"Saturday, 16 September",10,"Bring your creative ideas to life with Adobe Illustrator, the industry-standard vector graphics software, used by designers and illustrators who want to create digital graphics, logos, illustrations, and original typography. This workshop is designed to get you up and running with Adobe Illustrator in just one day. The focus will be on step-by-step instruction leading students through the most important tools and concepts in Illustrator.",220,Atlanta
http://generalassemb.ly/education/fundamentals-of-python-bootcamp/atlanta/38450,Atlanta,Fundamentals of Python Bootcamp,"Saturday, 8 July",10,"Whether you have experience in programming or are looking to get started for the first time, this workshop will put you on the fast track to honing your python and data analysis skills.  In this bootcamp you’ll get hands-on programming experience in Python that you'll be able to immediately apply in the real world.  The workshop will cover the fundamentals of Python and several tools used in data science.",150,Atlanta
