Link,Location,Title,Date,Time,Description,Price,Location
http://generalassemb.ly/education/how-to-get-your-first-5000-users/london/37704,London,"How to Get Your First 5,000 Users","Monday, 31 July",6:15,"You’ve built it, but how do you make them come?",35,Atlanta
http://generalassemb.ly/education/python-for-data-science-intermediate/washington-dc/38814,"Washington, D.C.",Python for Data Science (Intermediate),"Tuesday, 11 July",6:30,"Python is an excellent programming language for data science, due to its rich set of data structures, the maturity of its data-focused libraries, and its ability to execute all aspects of the data science pipeline. This workshop will lay the foundation for data science in Python by exploring its data structures and data manipulation capabilities, as well as giving you a better understanding of the Python environment. This class is also a recommended preparatory workshop for students planning to enroll in General Assembly's Data Science course.",75,Atlanta
http://generalassemb.ly/education/hack-an-seo-plan-in-90-minutes/sydney/38800,Sydney,Hack an SEO Plan in 90 Minutes,"Wednesday, 12 July",6,The success of any website depends on its ability to attract the right audience and convert them into sales and leads. SEO can be the most effective way to do this as it increases the discoverability of your website when your customers really need it.,35,Atlanta
http://generalassemb.ly/education/digital-marketing-101/sydney/39566,Sydney,Digital Marketing 101,"Thursday, 3 August",9:30,"This 2-hour deep-dive will take a holistic look at digital marketing, covering many of the essential digital advertising platforms, tools and analytics systems that entrepreneurs & digital marketers alike use to help launch & optimize their online businesses.",50,Atlanta
http://generalassemb.ly/education/introduction-to-google-analytics/san-francisco/37894,San Francisco,Introduction to Google Analytics,"Thursday, 9 November",6:30,"Google Analytics is an incredibly robust, free tool for measuring web traffic data. In this class, you’ll get to know the basics of using Google Analytics to track and evaluate performance and draw insights to improve your business. Starting with basic terminology and key metrics, you’ll build a foundation of knowledge before diving deeper into more complex analytics techniques, including advertising tracking and custom segments. You’ll walk away with a fundamental understanding of Google Analytics’ role in running and operating your business.",65,Atlanta
http://generalassemb.ly/education/visual-design-101/san-francisco/37934,San Francisco,Visual Design 101,"Monday, 18 September",6:30,Get creative with Sketch.,40,Atlanta
http://generalassemb.ly/education/javascript-101/new-york-city/38508,New York City,Javascript 101,"Wednesday, 30 August",6:30,Expand your coding toolkit with the No. 1 language in tech.,90,Atlanta
http://generalassemb.ly/education/facebook-advertising-bootcamp/new-york-city/38530,New York City,Facebook Advertising Bootcamp,"Friday, 22 September",10,"To become a great Facebook Marketer, you have to truly master the nuances of the platform, and leverage industry vetted best practices. In this hands on Bootcamp, you'll discover how to go beyond just boosting posts by leveraging Custom Audiences and advanced Bidding Strategies. You’ll also learn how to properly measure and optimize your campaigns using both the Facebook pixel and other measurement platforms. In addition, you’ll learn how to achieve your business objectives by integrating Facebook with other Marketing channels including Email and Google AdWords.",299,Atlanta
http://generalassemb.ly/education/intro-to-the-internet-of-things-iot/london/39090,London,Intro to The Internet Of Things (IoT),"Thursday, 7 September",6:15,"Interest in the Internet of Things is exploding and industry experts project this sector will represent over $15 trillion by 2020. To make the most of this important trend you have to understand the players, technology and the new solutions that are coming to market.",25,Atlanta
http://generalassemb.ly/education/introduction-to-coding-html-css/denver/37981,Denver,Introduction to Coding: HTML & CSS,"Wednesday, 5 July",6,"Meet the programming languages that power the web, and write your first line of code.",25,Atlanta
http://generalassemb.ly/education/adobe-indesign-bootcamp/london/38165,London,Adobe InDesign Bootcamp,"Saturday, 16 September",10,"Bring your creative ideas to life with Adobe InDesign, the professional page layout standard, used by designers and production professionals to design, preflight, and publish a broad range of documents such as brochures, catalogs, magazines and books. InDesign allows you to lay out and design multiple page documents. This workshop is designed to get you up and running with Adobe InDesign in one day. The focus will be on step-by-step instruction leading students through the most important tools and concepts in InDesign.",100,Atlanta
http://generalassemb.ly/education/code-in-one-day-html-css-crash-course/singapore/37820,Singapore,Code in One Day: HTML & CSS Crash Course,"Saturday, 23 September",10,"HTML and CSS are the fundamental building blocks of the web. Whether you're a beginner who wants to get started in web development, a designer looking to hand-code their concepts, or a marketer who wants a little more control over their CMS, you'll need to know HTML and CSS to get the job done.",150,Atlanta
http://generalassemb.ly/education/understanding-the-stack-a-non-programmers-guide-to-web-and-mobile-programming/london/38662,London,Understanding the Stack: A Non-Programmer's Guide to Web and Mobile Programming,"Tuesday, 18 July",6:15,"Learn to talk the talk without walking the walk. This class is for people who want to speak intelligently about tech. Whether you're recruiting developers, a first-time product manager, or simply want to work in a tech startup, you need to know what is happening in the engineering department.",35,Atlanta
http://generalassemb.ly/education/google-analytics-bootcamp/san-francisco/37931,San Francisco,Google Analytics Bootcamp,"Saturday, 22 July",10,"Learn how to use your Google Analytics to get real insights into your website’s visitors, their behavior and any patterns and trends. You will learn the lean smart way to gain customer insights and then turn these into actions that will drive your business forward.",150,Atlanta
http://generalassemb.ly/education/agile-and-scrum-bootcamp/san-francisco/38127,San Francisco,Agile and Scrum Bootcamp,"Sunday, 6 August",10,"You're heard the term Agile, but what does it really mean and how does it all work? In the first half of the class we'll go over Agile fundamentals. This includes the guiding philosophy, the ""rituals"", and how to get a team up and running using Agile principals. The second half of the class will focus on the product owner role within Agile. Specifically we focus on how to write good user stories. This will be hands on and you'll get plenty of practice writing user stories that can be given to development. We'll end the class by breaking into teams and running a retrospective. Expect to walk out of class with ideas that you can bring to your own team on Monday.",250,Atlanta
http://generalassemb.ly/education/user-experience-design-bootcamp/chicago/39328,Chicago,User Experience Design Bootcamp,"Saturday, 23 September",10,"As technology changes and more media outlets compete for customers’ time, providing an enjoyable experience is critical to both attracting and keeping users.  This class aims to demystify UX by giving a practical and simple introduction to what UX is while also explaining some of its core concepts of usability.  This is a field that affects all areas of business — prepare to dip your toes into an ocean of new concepts and ideas that will enlighten your perspective on the  human-computer interaction experience.",210,Atlanta
http://generalassemb.ly/education/content-marketing-for-beginners/sydney/39066,Sydney,Content Marketing For Beginners,"Wednesday, 26 July",6,"Content Marketing has become the biggest buzzword in digital marketing, but very few people really know how to integrate content into their brand in a cohesive, strategic, and optimised way.",60,Atlanta
http://generalassemb.ly/education/introduction-to-financial-modeling-for-growth-bootcamp/san-francisco/38547,San Francisco,Introduction to Financial Modeling for Growth Bootcamp,"Saturday, 9 September",10,"As organization and companies become increasingly data driven with greater pressure to achieve financial results in condensed time frames, a fundamental understanding of financial statements and financial modeling is critical to your success whether at a larger company or entrepreneurial venture. Product, technical and marketing professionals can be empowered by understanding this language and skill to gain approval for new products, programs as well increased budgets for their key priorities. Entrepreneurs will of course need to understand this not only to raise funding but to ensure their ventures are sustainable for the long term.",85,Atlanta
http://generalassemb.ly/education/digital-marketing-key-metrics/london/37309,London,Digital Marketing: Key Metrics,"Wednesday, 16 August",2,"Become a data-driven marketer with this digital marketing key metrics class. Your marketing efforts need to be accountable, and you can’t improve what you don’t measure. Metrics—whether they be revenue, customer satisfaction, or engagement—become the driving force of our success. In this class, you’ll learn how to use the right analytics to grow your business, motivate your team, and communicate a coherent story to stakeholders using hard numbers. Break down the jargon, lose the fluffy reports and understand the data behind your marketing programmes.",55,Atlanta
http://generalassemb.ly/education/anatomy-of-an-idea/atlanta/38365,Atlanta,Anatomy of an Idea,"Wednesday, 2 August",6:30,This workshop is oriented around a real world challenge. We’ll use a four-step process to experience the anatomy of an idea.  We’ll walk through…,35,Atlanta
http://generalassemb.ly/education/digital-marketing-bootcamp--2/new-york-city/38492,New York City,Digital Marketing Bootcamp,"Saturday, 22 July",10,"The digital landscape is moving at lightning speed. Every industry has been affected by the advances in digital—from retail to brands and agencies. Has your manager recently assigned a digital marketing role to you? Are you a project or account manager at a creative agency? Do you work for a small company or a start-up, and handle all things digital on your own? Then this bootcamp may be just what you need! Specifically created for students and professionals interested in gaining a deeper understanding of everything digital marketing can encompass.",299,Atlanta
http://generalassemb.ly/education/javascript-101/atlanta/38369,Atlanta,Javascript 101,"Tuesday, 29 August",6:30,Expand your coding toolkit with the No. 1 language in tech.,28,Atlanta
http://generalassemb.ly/education/visual-design-fundamentals/san-francisco/39124,San Francisco,Visual Design Fundamentals,"Monday, 31 July",7,"The goal of visual design is to communicate a specific message to a targeted audience. Through the intentional and aesthetic manipulation of elements, one is able to influence and inspire. Color theory, layout and typography are among the many areas covered in this course, as well as common practices, such as creative briefs and approval processes.",40,Atlanta
http://generalassemb.ly/education/user-experience-journey-mapping/austin/39059,Austin,User Experience: Journey Mapping,"Thursday, 10 August",7,"You are not your user. It’s one of the most critical understandings of a User Experience designer. And knowing that to be true, it becomes even more critical for designers to build empathy for and relate to the users they are designing for.",35,Atlanta
http://generalassemb.ly/education/coding-101-html-css/chicago/39192,Chicago,Coding 101: HTML & CSS,"Thursday, 31 August",6,"Meet the programming languages that power the web, and write your first line of code.",40,Atlanta
http://generalassemb.ly/education/basics-of-scrum/london/38959,London,Basics of Scrum,"Thursday, 14 September",6:15,"Gain an understanding of the principles behind this popular project management framework. In this class you’ll get a brief history and explanation of the core values and principles of the Agile Manifesto and how Scrum relates to it. We’ll cover the roles and ceremonies of Scrum, as well as explain the most common approach that Scrum teams use for estimating and planning projects.",35,Atlanta
http://generalassemb.ly/education/ux-design-101/new-york-city/38501,New York City,UX Design 101,"Thursday, 27 July",6:30,Discover how design shapes our online experiences.,60,Atlanta
http://generalassemb.ly/education/free-lunchtime-class-taxation-early-to-advanced-start-ups/sydney/37505,Sydney,Free Lunchtime Class: Taxation - Early to Advanced Start Ups,"Thursday, 13 July",12:30,"Like many areas, tax has its own language, words and concepts. These can be confusing for startups new to the business world, or the changing needs of businesses that are growing rapidly.",0,Atlanta
http://generalassemb.ly/education/excel-bootcamp/sydney/37907,Sydney,Excel Bootcamp,"Saturday, 8 July",10,"For most professionals, the ability to organize information is quickly becoming a fundamental part of the job description. Whether you already consider yourself an expert or are just getting started with spreadsheets, this hands-on workshop will allow you to take your skills to next level and become an Excel pro.",180,Atlanta
http://generalassemb.ly/education/code-in-one-day-html-css-crash-course/washington-dc/38702,"Washington, D.C.",Code in One Day: HTML & CSS Crash Course,"Saturday, 12 August",10,"HTML and CSS are the fundamental building blocks of the web. Whether you're a beginner who wants to get started in web development, a designer looking to hand-code your concepts, or a marketer who wants a little more control over your CMS, you'll need to know HTML and CSS to get the job done.
This one-day workshop is the quickest way to get started building websites and modifying code. We'll go over key coding terminology and principles, introduce HTML and CSS—what their functions are, how they work together—and use that new knowledge to write our own code and develop our own simple site.",200,Atlanta
http://generalassemb.ly/education/product-management-bootcamp/austin/39229,Austin,Product Management Bootcamp,"Saturday, 22 July",10,"You’re full of ideas, but how do you know which are worth working on?  In the first half of the workshop, you’ll learn how to use the MVP (Minimum Viable Product) philosophy to test and validate your ideas with the least amount of work required.  The ultimate goal is to get to product/market fit.  Take your idea and get moving in the right direction quickly and efficiently.",175,Atlanta
http://generalassemb.ly/education/introduction-to-adobe-illustrator--2/boston/36795,Boston,Introduction to Adobe Illustrator,"Monday, 10 July",6:30,"Bring your creative ideas to life with Adobe Illustrator, the industry-standard vector graphics software, used by designers and illustrators who want to create digital graphics, logos, illustrations, and original typography. This workshop is designed to get you up and running with Adobe Illustrator in just three hours. The focus will be on step-by-step instruction leading students through the most important tools and concepts in Illustrator.",75,Atlanta
http://generalassemb.ly/education/speaking-to-engage-become-a-better-and-funnier-public-speaker/san-francisco/38716,San Francisco,Speaking to Engage: Become a Better and Funnier Public Speaker,"Wednesday, 19 July",6,"Learn Comedy Habits to be a better public speaker, consistently funnier and help rid the world of boring presentations!",65,Atlanta
http://generalassemb.ly/education/sql-bootcamp-learning-the-language/san-francisco/39262,San Francisco,SQL Bootcamp: Learning the Language,"Tuesday, 26 September",10,"SQL is a powerful language, and tool, for data analysis and data handling. In this bootcamp, you’ll dive deep into SQL syntax and database structures, while applying your new SQL skills to address business problems. This bootcamp will take absolute beginners through the basics of SQL to an ability to write queries with confidence.",299,Atlanta
http://generalassemb.ly/education/hacking-communication/los-angeles/39280,Los Angeles,Hacking Communication,"Monday, 24 July",6:30,"No matter what line of business you’re in, being able to clearly communicate your ideas is a critical part of becoming a success. Whether you’re presenting a project or just taking a meeting, knowing how to think on your feet and effectively express yourself is key to connecting and collaborating with your peers.",65,Atlanta
http://generalassemb.ly/education/crafting-stories-with-data/washington-dc/37405,"Washington, D.C.",Crafting Stories with Data,"Wednesday, 26 July",6:30,"Data visualizations can enable us to compress data and encode them in ways to aid perceptual, cognitive and emotional capacity required to comprehend, retain and make decisions using this data. It is often cited that we are trying to tell stories through them. Is that really the case? How do we ensure that the audience is able to retain, recall and retell our data-driven stories?",65,Atlanta
http://generalassemb.ly/education/digital-marketing-bootcamp--2/san-francisco/37843,San Francisco,Digital Marketing Bootcamp,"Saturday, 15 July",10,"This deep-dive will take a holistic look at digital marketing-- covering many of the essential (and cutting edge) digital advertising platforms, tools and analytics systems that entrepreneurs & digital marketers alike use to help launch & optimize their online businesses. Not only will this bootcamp survey these topics, but students will also be trained on 2 best-in-class digital marketing tools (Facebook & Mailchimp).",250,Atlanta
http://generalassemb.ly/education/python-programming-101/denver/38564,Denver,Python Programming 101,"Tuesday, 25 July",6,Unlock data-driven insights with code.,45,Atlanta
http://generalassemb.ly/education/unlock-your-creative-confidence/melbourne/38524,Melbourne,Unlock Your Creative Confidence,"Saturday, 29 July",10,"Get your creative juices flowing with hands-on, minds-on activities. In this workshop you'll explore the art of improvisation, play with LEGO and build your very own puppet from trash with Trash Puppets.",180,Atlanta
http://generalassemb.ly/education/programmatic-advertising-101/sydney/39593,Sydney,Programmatic Advertising 101,"Tuesday, 15 August",6,"In this class, students will learn the basic concepts of programmatic and its role in the digital media landscape.",35,Atlanta
http://generalassemb.ly/education/visual-design-101/atlanta/39362,Atlanta,Visual Design 101,"Monday, 24 July",7,Get creative with Adobe Photoshop.,30,Atlanta
http://generalassemb.ly/education/how-to-land-a-job-in-product-management-8747b12e-b7b5-490d-97a2-0f31c9b6a228/austin/38542,Austin,How to Land a Job in Product Management,"Saturday, 26 August",9,Breaking into product management can be difficult.,175,Atlanta
http://generalassemb.ly/education/picture-this-instagram-for-business/london/38168,London,Picture This: Instagram for Business,"Thursday, 21 September",6:15,"As one of the fastest-growing social networks of our decade, Instagram has risen to the top of the content food chain, and is constantly adding new features and tricks for you or your business to take advantage of.",25,Atlanta
http://generalassemb.ly/education/project-management-masterclass/sydney/39606,Sydney,Project Management Masterclass,null,null,"Digital Producers and project managers work in one of the most fast-paced and ever-changing industries and with every project we are being introduced to a new piece of technology, development tool, CMS or complex creative idea that need to be executed in almost no time and within limited budgets.",100,Atlanta
http://generalassemb.ly/education/introduction-to-adobe-illustrator--2/austin/39374,Austin,Introduction to Adobe Illustrator,"Wednesday, 9 August",6:30,"Bring your creative ideas to life with Adobe Illustrator, the industry-standard vector graphics software, used by designers and illustrators who want to create digital graphics, logos, illustrations, and original typography. This workshop is designed to get you up and running with Adobe Illustrator in just three hours. The focus will be on step-by-step instruction leading students through the most important tools and concepts in Illustrator.",75,Atlanta
http://generalassemb.ly/education/mastering-talks-and-presentations/london/37912,London,Mastering Talks and Presentations,"Monday, 7 August",6:15,"In this overview, we will explore how you are communicating and how that is enhancing or taking away from your effectiveness. We will do this by engaging in fun interactive exercises that will help you put together presentations and talks that are focused and get your point across effectively.",35,Atlanta
http://generalassemb.ly/education/sql-bootcamp-learning-the-language/san-francisco/39263,San Francisco,SQL Bootcamp: Learning the Language,"Saturday, 30 September",10,"SQL is a powerful language, and tool, for data analysis and data handling. In this bootcamp, you’ll dive deep into SQL syntax and database structures, while applying your new SQL skills to address business problems. This bootcamp will take absolute beginners through the basics of SQL to an ability to write queries with confidence.",299,Atlanta
http://generalassemb.ly/education/a-beginners-guide-to-email-marketing/los-angeles/39458,Los Angeles,A Beginner's Guide to Email Marketing,"Thursday, 28 September",7,"With the latest research showing that 75% of consumers want to hear your marketing words via email—if you’re not already using this cost effective way of connecting with customers, your business is missing out. This session, aimed at small businesses on tight budgets, will show you how to get started with the basics of email marketing.",35,Atlanta
http://generalassemb.ly/education/introduction-to-python-bootcamp/new-york-city/38496,New York City,Introduction to Python Bootcamp,"Saturday, 19 August",10,"Python is a versatile and widely-used programming language with many applications. This workshop explores Python's place in the scientific ecosystem, and how the language, with several readily-available open-source libraries, can serve as a powerful tool for data analysis. Designed as a stand-alone introduction to the data science aspects of Python, this class is also a recommended refresher for students planning to enroll in General Assembly's upcoming Data Science course. The course is hands-on and exercise based, so students will get plenty of practice.",299,Atlanta
http://generalassemb.ly/education/getting-started-with-wordpress/washington-dc/37699,"Washington, D.C.",Getting Started With WordPress,"Saturday, 8 July",10,"WordPress is the premier content management system for those seeking an easy, user-friendly way to set up and maintain a website.",145,Atlanta
http://generalassemb.ly/education/visual-design-101/washington-dc/37538,"Washington, D.C.",Visual Design 101,"Monday, 24 July",6:30,Get creative with Adobe Photoshop.,55,Atlanta
http://generalassemb.ly/education/user-experience-design-bootcamp/san-francisco/39138,San Francisco,User Experience Design Bootcamp,"Saturday, 22 July",10,"As technology changes and more media outlets compete for customers’ time, providing an enjoyable experience is critical to both attracting and keeping users.  This class aims to demystify UX by giving a practical and simple introduction to what UX is while also explaining some of its core concepts of usability.  This is a field that affects all areas of business — prepare to dip your toes into an ocean of new concepts and ideas that will enlighten your perspective on the  human-computer interaction experience.",250,Atlanta
http://generalassemb.ly/education/digital-marketing-bootcamp--2/austin/37851,Austin,Digital Marketing Bootcamp,"Saturday, 15 July",10,"The digital landscape is moving at lightning speed. Every industry has been affected by the advances in digital—from retail to brands and agencies. Has your manager recently assigned a digital marketing role to you? Are you a project or account manager at a creative agency? Do you work for a small company or a start-up, and handle all things digital on your own? Then this bootcamp may be just what you need! Specifically created for students and professionals interested in gaining a deeper understanding of everything digital marketing can encompass.",175,Atlanta
http://generalassemb.ly/education/lean-thinking-back-to-the-basics/melbourne/39024,Melbourne,Lean Thinking: Back to the Basics,"Monday, 7 August",6:30,"Businesses are facing a number of challenges today, everyone is under pressure to do business differently and achieve more with less. Technology advances are rapid and impacting the way we operate.",35,Atlanta
http://generalassemb.ly/education/design-thinking-workshop/melbourne/38724,Melbourne,Design Thinking Workshop,"Wednesday, 26 July",6,"Design Thinking is the quintessential combination of both creative and critical thinking. It focuses on contextual, insight driven solutions instead of just the problem on hand. The approach utilises the principles of divergent thinking, which is about discovering and brainstorming ideas with minimal restrictions and waste.",70,Atlanta
